{
  "schemaVersion": "0.1.0",
  "diagnosisId": "4a3c9d2f-8e5b-4a7c-9b3d-2f6e8a0c1b4d",
  "createdAt": "2026-07-12T18:05:22.541Z",
  "nodeId": "127.0.0.1:8188",
  "envHash": "59a135a492c27143ee3fa31ce8a09481",
  "env": {
    "os": "Windows-11",
    "python": "3.12.10",
    "torch": "2.7.1+cu128",
    "torchCuda": "cu128",
    "driver": "576.88",
    "comfyuiVersion": "0.3.44"
  },
  "run": {
    "promptId": "a1b2c3d4-0002-4000-8000-000000000002",
    "workflowHash": "0ba8e9025f6c0524e0c6a63766a31b8f",
    "status": "completed",
    "durationS": 40.8,
    "vramPeakGb": null,
    "stages": [
      { "stage": "9:KSampler", "ms": 36500.0 },
      { "stage": "8:VAEDecode", "ms": 2080.0 }
    ]
  },
  "triggers": [],
  "findings": [
    {
      "code": "offload_disabled",
      "severity": "warn",
      "actionable": true,
      "explanation": "Model offload is disabled on a box whose VRAM history shows pressure; enabling offload trades speed for headroom.",
      "fixHint": "Launch ComfyUI with --lowvram or enable smart offload."
    }
  ]
}
